{
  "ncp_version": "1.0",
  "kind": "close_session",
  "session_id": "vec-open-1",
  "session": {
    "generation": "293279f3-d459-4bfd-aeeb-604799e96925"
  },
  "operation": {
    "operation_id": "10000000-0000-4000-8000-000000000003",
    "request_digest": "d1195d90bc7d7050ce67192430210460ff7cea0414bdc5c45b458a7dcb039afb",
    "session_epoch": "293279f3-d459-4bfd-aeeb-604799e96925",
    "expected_state_version": 3,
    "deadline_utc_ms": 1700000030000,
    "retry": false
  },
  "authority": {
    "session_epoch": "293279f3-d459-4bfd-aeeb-604799e96925",
    "term": 1,
    "lease_id": "20000000-0000-4000-8000-000000000001",
    "issuer_principal_id": "controller-principal-1",
    "holder_principal_id": "controller-principal-1",
    "holder_entity_id": "pid-controller-1",
    "issued_at_utc_ms": 1700000000000,
    "expires_at_utc_ms": 1700000030000
  }
}
